<!DOCTYPE lensdatabase SYSTEM "lensfun-database.dtd">
<lensdatabase version="2">

    <mount>
        <name>Hasselblad X</name>
        <compat>Generic</compat>
    </mount>

    <camera>
        <maker>Hasselblad</maker>
        <model>X1D II 50C</model>
        <mount>Hasselblad X</mount>
        <cropfactor>0.79</cropfactor>
    </camera>

    <camera>
        <maker>Hasselblad</maker>
        <model>X2D 100C</model>
        <mount>Hasselblad X</mount>
        <cropfactor>0.79</cropfactor>
    </camera>

    <camera>
        <maker>Hasselblad</maker>
        <model>CFV II 50C/907X</model>
        <mount>Hasselblad X</mount>
        <cropfactor>0.79</cropfactor>
    </camera>

    <camera>
        <maker>Hasselblad</maker>
        <model>CFV 100C/907X</model>
        <mount>Hasselblad X</mount>
        <cropfactor>0.79</cropfactor>
    </camera>

</lensdatabase>
